,title,id,max_occur_words,max_occur_number,content_original,content
121,2009 Saint Francis Cougars football team,122,cougar,6,"2009 Saint Francis Cougars football team

The 2009 Saint Francis Cougars football team represented the University of Saint Francis, located in Fort Wayne, Indiana, in the 2009 NAIA football season. They were led by head coach Kevin Donley, who served his 12th year as the first and only head coach in the history of Saint Francis football. The Cougars played their home games at Bishop John D'Arcy Stadium and were members of the Mid-States Football Association (MSFA) Mideast League (MEL). The Cougars finished tied for 2nd place in the MSFA MEL division; they missed the postseason NAIA playoffs for only second time in the team's history.

The 2009 season saw the first home loss since 2001 in a November 7 defeat by St. Xavier. Over that time period, the Cougars won 56 consecutive home games. It also marked the first time the Cougars were not in the NAIA postseason playoff since their inaugural 1998 season.",2009 saint franci cougar footbal team 2009 saint franci cougar footbal team repres univers saint franci locat fort wayn indiana 2009 naia footbal season. lead head coach kevin donley serv 12th year head coach histori saint franci football. cougar play game bishop john arci stadium member mid footbal associ msfa mideast leagu mel . cougar finish tie 2nd place msfa mel division; miss postseason naia playoff time team history. 2009 season loss 2001 novemb 7 defeat st. xavier. time period cougar 56 consecut games. mark time cougar naia postseason playoff inaugur 1998 season.
122,Ulla Flegel,123,ulla flegel,2,"Ulla Flegel

Ulla Flegel (born 22 October 1939) is an Austrian athlete. She competed in the women's high jump at the 1964 Summer Olympics.",ulla flegel ulla flegel born 22 octob 1939 austrian athlete. compet woman high jump 1964 summer olympics.
123,Corral del Coliseo,124,corral,13,"Corral del Coliseo

The Corral del Coliseo is an old corral de comedias (a Spanish theatre) of 16th century in Seville (Andalusia, Spain), near the Plaza de la Encarnación square, which was later converted into a corral of neighbors and is currently is used as a residential building.

It has been documented that in March of 1612, ""Claramonte"" directs the Corral del Coliseo in Seville, and promises to provide the Company with ""eight old or already premiered comedies for four hundred reales, and new or never seen, at a rate of 250 reales"". It is also known that in 1620, ""Ortiz y los Valencianos"" represented the work of ""Claramonte"" ""The Great King of the Deserts"" in the Corral del Coliseo. In this same year the Corral del Coliseo suffered a devastating fire.

A lawsuit in 1619 between the owner of the Corral del Coliseo and some authors of comedies also serves as a guide to understand the society of the time. The complaint was lodged by Francisco de Rivera, landlord of the Corral del Coliseo, on June 5, 1619, before Juan Muñoz de Escovar, """"of the Council and Accountant major of accounts of His Majesty, Judge of the Performance of this city of Seville"""", against Juan Acacio and Diego de Vallejo (both authors of comedies), because they decided to represent the autos sacramentales of Corpus Christi in the ""Corral de doña Elvira"". With this, they contravened a previous resolution, of May 25, of the same judge in which he arranged to be represented in the Corral del Coliseo. For what said the landlord of the Corral """"...because such contempt should not be given, to your mercy I beg and beg, command to arrest the said authors of comedies, which are Juan Acacio and Diego de Vallejo, and remove the posters that are placed, executing them for the penalties in which they have incurred and in the damages that the treasury of this city for the said cause have been followed and continue, and I ask for justice. / So for proof of the above, I make a demonstration of one of the posters that the aforementioned have posted by the corners and the auto for your mercy provided and notifications, and I ask for justice..."""". They serve these writings to revive the society of the time and understand the theater of the Spanish golden age.

Also referred to the Corral del Coliseo in a contract by which he was forced to represent 30 functions to the company that ran the parents of Bárbara Coronel and in which she herself acted, before being a renowned actress in that epoch.",corral del coliseo corral del coliseo corral comedia spanish theatr 16th centuri sevil andalusia spain plaza la encarnación squar convert corral neighbor residenti building. document march 1612 claramont direct corral del coliseo sevil promis provid compani premier comedi real rate 250 real . 1620 ortiz lo valenciano repres work claramont great king desert corral del coliseo. year corral del coliseo suffer devast fire. lawsuit 1619 owner corral del coliseo author comedi serf guid understand societi time. complaint lodg francisco rivera landlord corral del coliseo june 5 1619 juan muñoz escovar council account major account majesti judg perform citi sevil juan acacio diego vallejo author comedi decid repres auto sacramental corpu christi corral doña elvira . contraven previou resolut 25 judg arrang repres corral del coliseo. landlord corral ...becaus contempt merci beg beg command arrest author comedi juan acacio diego vallejo remov poster execut penalti incur damag treasuri citi continu justice. proof demonstr poster aforement post corner auto merci notif justice... . serv write reviv societi time understand theater spanish golden age. refer corral del coliseo contract forc repres 30 function compani parent bárbara coronel act renown actress epoch.
124,Galina Kostenko,125,galina kostenko,2,"Galina Kostenko

Galina Kostenko (born 8 October 1938) is a Soviet athlete. She competed in the women's high jump at the 1964 Summer Olympics.",galina kostenko galina kostenko born 8 octob 1938 soviet athlete. compet woman high jump 1964 summer olympics.
125,Mike Bugarewicz,126,mike bugarewicz nascar crew chief,2,"Mike Bugarewicz

Michael ""Mike"" Bugarewicz is an American NASCAR crew chief. He is currently employed at Stewart-Haas Racing, serving as the crew chief since 2016 for the No. 14 Ford Fusion in the Monster Energy NASCAR Cup Series. The car is currently driven by Clint Bowyer, and they are both expected to return for the 2018 season.",mike bugarewicz michael mike bugarewicz american nascar crew chief. employ stewart haa race serv crew chief 2016 no. 14 ford fusion monster energi nascar cup series. car driven clint bowyer expect return 2018 season.
126,Gwenda Matthews,127,gwenda,2,"Gwenda Matthews

Gwenda Matthews (born 6 June 1944) is a British athlete. She competed in the women's high jump at the 1964 Summer Olympics.",gwenda matthew gwenda matthew born 6 june 1944 british athlete. compet woman high jump 1964 summer olympics.
127,Wairua,128,wairua,2,"Wairua

Wairua may refer to:",wairua wairua refer
128,Mitsuko Torii,129,mitsuko torii,2,"Mitsuko Torii

Mitsuko Torii (born 9 August 1943) is a Japanese athlete. She competed in the women's high jump at the 1964 Summer Olympics.",mitsuko torii mitsuko torii born 9 august 1943 japanes athlete. compet woman high jump 1964 summer olympics.
129,Justin Watkins,130,watkin,7,"Justin Watkins

Justin Lee Watkins (born May 27, 1979) is a Democratic member of the Nevada Assembly. He represents the 35th district, which covers parts of the southwestern Las Vegas Valley.

Watkins was born in Las Vegas in 1979, and graduated from Oregon State University in 2001. He received his Juris Doctor from the University of San Diego School of Law in 2004. Watkins practices law with Battle Born Injury Lawyers, a firm that includes fellow Assemblyman Steve Yeager. He is licensed to practice law in California, Nevada, and Utah.

Watkins ran for the Assembly in 2016. He was unopposed in the Democratic primary and defeated incumbent Republican Brent A. Jones.

In October 2017, Watkins announced he would not seek reelection in 2018.

Watkins and his wife, Marni, have 2 daughters; Adyson and Sydney.

Watkins identifies as a moderate Democrat. He supports expanding background checks for gun purchases.",justin watkin justin lee watkin born 27 1979 democrat member nevada assembly. repres 35th district cover part southwestern la vega valley. watkin born la vega 1979 graduat oregon univers 2001. receiv juri doctor univers san diego school law 2004. watkin practic law battl born injuri lawyer firm includ fellow assemblyman steve yeager. licens practic law california nevada utah. watkin assembl 2016. unoppos democrat primari defeat incumb republican brent a. jones. octob 2017 watkin announc seek reelect 2018. watkin wife marni 2 daughters; adyson sydney. watkin identifi moder democrat. support expand background check gun purchases.
130,Nazli Bayat Makou,131,nazli bayat makou,2,"Nazli Bayat Makou

Nazli Bayat Makou (born 16 September 1945) is an Iranian athlete. She competed in the women's high jump at the 1964 Summer Olympics.",nazli bayat makou nazli bayat makou born 16 septemb 1945 iranian athlete. compet woman high jump 1964 summer olympics.
131,Ariari,132,ariari,2,"Ariari

Ariari or Ariyari is one of the six blocks of Sheikhpura district of Bihar, India.",ariari ariari ariyari block sheikhpura district bihar india.
132,2017–18 Brown Bears women s basketball team,133,women,6,"2017–18 Brown Bears women's basketball team

The 2017–18 Brown Bears women's basketball team represents Brown University during the 2017–18 NCAA Division I women's basketball season. The Bears, led by fourth year head coach Sarah Behn, play their home games at the Pizzitola Sports Center and are members of the Ivy League.

They finished the season 17–13, 7–7 in Ivy League play to finish in a tie for fourth place. They lost in the semifinals of the Ivy Women's Tournament to Penn. They were invited to the Women's Basketball Invitational where defeated UMBC in the first round before losing in the quarterfinals to UNC Greensboro.

!colspan=9 style=| Non-conference regular season
!colspan=9 style=| Ivy League regular season
!colspan=9 style=| Ivy League Women's Tournament",2017 18 brown bear woman basketbal team 2017 18 brown bear woman basketbal team repres brown univers 2017 18 ncaa divis woman basketbal season. bear lead fourth year head coach sarah behn play game pizzitola sport center member ivi league. finish season 17 13 7 7 ivi leagu play finish tie fourth place. lose semifin ivi woman tournament penn. invit woman basketbal invit defeat umbc lose quarterfin unc greensboro. !colspan 9 style confer regular season !colspan 9 style ivi leagu regular season !colspan 9 style ivi leagu woman tournament
133,Tipapan Leenasen,134,tipapan leenasen,2,"Tipapan Leenasen

Tipapan Leenasen (born 9 September 1943) is a Thai athlete. She competed in the women's high jump at the 1964 Summer Olympics.",tipapan leenasen tipapan leenasen born 9 septemb 1943 thai athlete. compet woman high jump 1964 summer olympics.
134,Warakamai,135,warakamai,5,"Warakamai

The Warakamai, now more frequently known as the Warrgamay, are an indigenous Australian people of the state of Queensland.

Their language, Warrgamay, is now extinct. It was a variety of Dyirbalic, and appears to be composed of three distinct dialects:""Wargamaygan"" spoken around the lower reaches of the Herbert River; ""Biyay"" spoken at the mouth of the Herbert, in the area of Halifax and Bemerside; and ""Hinchinbrook Biyay,"" spoken around the coastal area south of Cardwell and offshore on Hinchinbrook Island.

The Warakamai were the indigenous people of Halifax Bay, and held in Norman Tindale's calculations, approximately of tribal domains. An early resident, James Cassady, specified that they had 50 miles of shortline extending into the hinterland approximately 15 miles. Their northern neighbours were the Girramay, while to their south lay the Wulgurukaba.

The Warakamai were divided into several hordes:

The intermarriage of groups has been classified as follows:

Circumcision as an initiatory rite was unknown among the Warakamai. They did practice tooth avulsion, ritual scarification and piercing of the septum to wear nose bones. Polygamy was common, and widows were married to their deceased husband's brother.

The area of Halifax Bay first began to be settled by white colonialists in 1865. At that time the numbers of Warakami were estimated to amount to roughly 500 people. Within 15 years, they had declined by 300, a mere 40 of the surviving 200 being men. The difference was due to their being relentlessly hunted and gunned down by mounted native troopers under white supervision, together with settlers, both of whom 'shot as many of the males of the tribe as possible.'",warakamai warakamai frequent warrgamay indigen australian peopl queensland. languag warrgamay extinct. varieti dyirbal appear compos distinct dialect wargamaygan spoken reach herbert river; biyay spoken mouth herbert area halifax bemerside; hinchinbrook biyay spoken coastal area south cardwel offshor hinchinbrook island. warakamai indigen peopl halifax bay held norman tindal calcul tribal domains. earli resid jame cassadi 50 mile shortlin extend hinterland 15 miles. northern neighbour girramay south lay wulgurukaba. warakamai divid hord intermarriag group classifi circumcis initiatori rite unknown warakamai. practic tooth avuls ritual scarif pierc septum wear nose bones. polygami common widow marri deceas husband brother. area halifax bay begin settl white colonialist 1865. time number warakami estim roughli 500 people. 15 year declin 300 mere 40 surviv 200 men. differ relentlessli hunt gun mount nativ trooper white supervis settler shot male tribe possible.
135,Bohrer,136,bohrer bohr german occup surnam liter mean bore drill notabl peopl includ,1,"Bohrer

Bohrer is a German occupational surname literally meaning ""one who bores/drills."" Notable people with this name include:",bohrer bohrer german occup surnam liter mean bore drills. notabl peopl includ
136,REDMAP,137,project republican,4,"REDMAP

REDMAP (short for Redistricting Majority Project) is a project of the Republican State Leadership Committee of the United States to increase Republican control of Congressional seats, largely through determination of electoral district boundaries. The project has reportedly made effective use of partisan gerrymandering, by relying on previously unavailable mapping software such as Maptitude to improve the precision with which district lines are strategically drawn.

""Salon"" editor David Daley, author of the 2016 book ""Ratf**ked"", argues that beginning in 2010, the GOP sought control of governorships and state legislatures for the express purpose of controlling redistricting to protect House Republican seats. This push was led by the Republican Senate Leadership Committee, and organized by Chris Jankowski as the Redistricting Majority Project. GOP strategist Karl Rove discussed this strategy with ""The Wall Street Journal"".",redmap redmap short redistrict major project project republican leadership committe unit increas republican control congression seat determin elector district boundaries. project reportedli effect partisan gerrymand reli unavail map softwar maptitud improv precis district line strateg drawn. salon editor david daley author 2016 book ratf ked argu 2010 gop sought control governorship legislatur express purpos control redistrict protect hous republican seats. push lead republican senat leadership committe organ chri jankowski redistrict major project. gop strategist karl rove discuss strategi wall street journal .
137,Vera Fonaroff,138,fonaroff,9,"Vera Fonaroff

Vera Fonaroff (June 14, 1883, Kiev - July 23, 1962, New York, NY) was an American classical violinist and violin teacher of Russian-Jewish heritage.

Born in Kiev on June 14, 1883, to Alexander and Sonia Hochstein, the family immigrated to the United States in 1900. In 1905 she married Mark Fonaroff, a fellow Russian emigrant who was also her violin teacher. They had two daughters. Olga Fonaroff (1910-1933) was mentally handicapped. Nina Fonaroff (1914-2003) became a dancer with the Martha Graham Dance Company.

At nine years old, Fonaroff debuted as a violin soloist with the Metropolitan Opera House Orchestra, and thereafter made frequent solo appearances. After a period in Engand, studying and touring as a soloist and recitalist with the pianist Richard Epstein, she returned to New York to study with Franz Kneisel. 
In 1909, Fonaroff joined the all-woman Olive Mead String Quartet as second violinist.

In 1923, Fonaroff began teaching at the Juilliard School. From 1926 to 1939 and 1948 to 1955, she taught violin, and she was director of violin instruction from 1924 to 1930. From 1941 to 1962, she was also on the faculty at the Mannes College of Music. Fonaroff also taught at the Damrosch Institute, the Henry Street Settlement Music School, and the Curtis Institute of Music in Philadelphia. Her students included Sanford Allen, the first black member of the New York Philharmonic.",vera fonaroff vera fonaroff june 14 1883 kiev juli 23 1962 york ny american classic violinist violin teacher russian jewish heritage. born kiev june 14 1883 alexand sonia hochstein famili immigr unit 1900. 1905 marri mark fonaroff fellow russian emigr violin teacher. daughters. olga fonaroff 1910 1933 mental handicapped. nina fonaroff 1914 2003 dancer martha graham danc company. year fonaroff debut violin soloist metropolitan opera hous orchestra frequent solo appearances. period engand studi tour soloist recitalist pianist richard epstein return york studi franz kneisel. 1909 fonaroff join woman oliv mead string quartet violinist. 1923 fonaroff begin teach juilliard school. 1926 1939 1948 1955 taught violin director violin instruct 1924 1930. 1941 1962 faculti mann colleg music. fonaroff taught damrosch institut henri street settlement music school curti institut music philadelphia. student includ sanford allen black member york philharmonic.
138,2017–18 Dartmouth Big Green women s basketball team,139,2017 18 dartmouth big green women basketbal season ivi leagu colspan 9 style,3,"2017–18 Dartmouth Big Green women's basketball team

The 2017–18 Dartmouth Big Green women's basketball team represents Dartmouth College during the 2017–18 NCAA Division I women's basketball season. The Big Green, led by fifth year head coach Belle Koclanes, play their home games at Leede Arena and are members of the Ivy League.

!colspan=9 style=| Non-conference regular season
!colspan=9 style=| Ivy League regular season
!colspan=9 style=| Ivy League Men's Tournament",2017 18 dartmouth big green woman basketbal team 2017 18 dartmouth big green woman basketbal team repres dartmouth colleg 2017 18 ncaa divis woman basketbal season. big green lead year head coach bell koclan play game leed arena member ivi league. !colspan 9 style confer regular season !colspan 9 style ivi leagu regular season !colspan 9 style ivi leagu men tournament
139,Rafael Moreira disambiguation,140,rafael moreira,3,"Rafael Moreira (disambiguation)

Rafael Moreira is a musician.

Rafael Moreira may also refer to:",rafael moreira disambigu rafael moreira musician. rafael moreira refer
140,Peter Jones surgeon,141,jone,9,"Peter Jones (surgeon)

Peter Henry Jones (1 March 1917 – 30 July 1984), was born in Monmouth and is best known for his role in assisting Sir Clement Price Thomas in the pneumonectomy of King George VI in 1951. 

He subsequently remained professionally close to Price Thomas, pursuing a career in Cardiothoracic surgery.
Jones was educated in Pontypool at Haberdashers' Aske's West Monmouth School.

Qualifying in medicine from Westminster Hospital Medical School in 1939, Jones stayed on at the hospital to complete his junior house posts. Between 1942 and 1946, he joined the Royal Army Medical Corps as a regimental medical officer to a field artillery regiment in North Africa and Italy. He witnessed the Salerno landing and the attack on Monte Cassino. Declining an elevation in rank, he opted to endure the rest of the war along with his regiment. Returning to England in 1946, Jones continued his surgical training and passed the FRCS in 1948. Afterwards, he joined the surgical team under Sir Clement Price Thomas at the Brompton Hospital and Westminster Hospitals.

Baguley and Davyhulme Hospitals appointed Jones as thoracic surgeon in 1955 and Manchester Royal Infirmary took him on in 1960. Also, in 1960, Jones attended the Presbyterian Hospital in San Francisco to learn new techniques in open heart surgery. After spending six months with Dr Frank Gerbode, he returned to Westminster Hospital as thoracic surgeon. 

As Hunterian Professor, he gave a lecture on bronchial sleeve resection in 1958. 

In 1951, Jones spent three weeks as resident surgeon in Buckingham Palace. On 23 September 1951, whilst still in the palace, he had assisted Price Thomas with the pneumonectomy on King George VI’s lung cancer. In return, he was awarded the MVO. The surgery has since been researched and re-enacted by real surgeons in Stephen Daldry's The Crown (TV series).

Jones enjoyed fishing and antique clocks. Coronary artery disease and an illness resulting in loss of voice limited his activities and resulted in his premature retirement.

He died on 30 July 1984 leaving his wife Monica, two children and four grandchildren.",peter jone surgeon peter henri jone 1 march 1917 30 juli 1984 born monmouth role assist sir clement price thoma pneumonectomi king georg vi 1951. subsequ remain profession close price thoma pursu career cardiothorac surgery. jone educ pontypool haberdash ask west monmouth school. qualifi medicin westminst hospit medic school 1939 jone stay hospit complet junior hous posts. 1942 1946 join royal armi medic corp regiment medic offic field artilleri regiment north africa italy. wit salerno land attack mont cassino. declin elev rank opt endur rest war regiment. return england 1946 jone continu surgic train pass frc 1948. join surgic team sir clement price thoma brompton hospit westminst hospitals. baguley davyhulm hospit appoint jone thorac surgeon 1955 manchest royal infirmari 1960. 1960 jone attend presbyterian hospit san francisco learn techniqu open heart surgery. spend month dr frank gerbod return westminst hospit thorac surgeon. hunterian professor lectur bronchial sleev resect 1958. 1951 jone spent week resid surgeon buckingham palace. 23 septemb 1951 palac assist price thoma pneumonectomi king georg vi’ lung cancer. return award mvo. surgeri research enact real surgeon stephen daldri crown tv seri . jone enjoy fish antiqu clocks. coronari arteri diseas ill loss voic limit activ prematur retirement. die 30 juli 1984 leav wife monica child grandchildren.
141,Facing It,142,poem vietnam,10,"Facing It

""Facing It"" is a poem by American poet and author Yusef Komunyakaa. It is a reflection on Komunyakaa's first visit to the Vietnam Veterans Memorial. Komunyakaa served in Vietnam from 1969 to 1970, during which time he wrote for army newspaper ""Southern Cross"". It is the second poem written by Komunyakaa about Vietnam. R. S. Gwynn has referred to the poem as “the most poignant elegy that has been written about the Vietnam War.” 

The poem was his second to deal with the topic of the Vietnam War. He first wrote a poem dealing with Vietnam fourteen years after returning from the war. ""Facing It"" was written approximately a year after visiting the Vietnam Veterans Memorial. Komunyakaa has said ""Facing It"" influenced the other poems of the collection in which it was first published, ""Dien Cai Dau"".

The poem concerns the speaker's visit to the Vietnam Veterans Memorial, a black gabbro wall engraved with the names of American soldiers who died in the war. The wall is polished so that it is reflective.

Like jazz, the poem appears to be free of form, but it is in fact split into a verse-bridge-verse structure similar to many jazz songs. The first thirteen lines reflect on the speaker's reaction, and the final thirteen reflect on the reactions of others; these two sections are separated by a shorter section describing the act of finding and touching a name.

The poem is one of several by Vietnam veterans to deal with memorials. Andrew Palmer and Sally Minogue have contrasted the ""ambivalent response"" of ""Facing It"" with W. D. Ehrhart's ""The Invasion of Grenada"", in which the speaker rejects the idea of a Vietnam memorial and refuses to engage with ""...that
vast black wall of broken lives"".

The poem has been anthologized in a number of collections, and is perhaps Komunyakaa's best known work.",face face poem american poet author yusef komunyakaa. reflect komunyakaa visit vietnam veteran memorial. komunyakaa serv vietnam 1969 1970 time write armi newspap southern cross . poem write komunyakaa vietnam. r. s. gwynn refer poem “the poignant elegi write vietnam war.” poem deal topic vietnam war. write poem deal vietnam fourteen year return war. face write year visit vietnam veteran memorial. komunyakaa face influenc poem collect publish dien cai dau . poem concern speaker visit vietnam veteran memori black gabbro wall engrav name american soldier die war. wall polish reflective. jazz poem appear free form fact split vers bridg vers structur jazz songs. thirteen line reflect speaker reaction final thirteen reflect reaction others; section separ shorter describ find touch name. poem vietnam veteran deal memorials. andrew palmer salli minogu contrast ambival respons face w. d. ehrhart invas grenada speaker reject idea vietnam memori refus engag ...that vast black wall broken life . poem antholog number collect komunyakaa work.
