,title,id,max_occur_words,max_occur_number,content_original,content
350,Ielidassen,351,ielidassen berber,3,"Ielidassen

Ielidassen (6th century) was a Moorish warrior whose name appears in the sixth century in the ""Iohannis"" of the Latin poet Corippus.

During the battle of Campi Mammenses, in southern Tunisia, the Roman Carosus strikes the Moor Ielidassen with his sword.

We don't know in antiquity another example of this anthroponym, which could mean in Berber ""their king""; on the other hand, it is found in the writings of Arabic authors of the Middle Ages, in the form Gellidasen or Gueldacen. It is still worn today by a Berber tribe from the Middle Atlas: Ait Jellidasen. This is one of the rare cases where the Latin transcription of a Berber name, which was stopped at a time, it is true, very low, has remained virtually unchanged until today. As a personal name, it seems to have fallen completely into disuse.",ielidassen ielidassen 6th centuri moorish warrior appear sixth centuri iohanni latin poet corippus. battl campi mammens southern tunisia roman carosu strike moor ielidassen sword. antiqu anthroponym berber king ; hand write arab author middl age form gellidasen gueldacen. worn today berber tribe middl atla ait jellidasen. rare case latin transcript berber stop time true remain virtual unchang today. person fall complet disuse.
351,Index of Sri Lanka related articles B,352,sri lanka articl,2,"Index of Sri Lanka-related articles (B)

This page lists Sri Lanka-related articles with titles beginning with an alphabet letter B.",sri lanka articl list sri lanka articl titl alphabet letter b.
352,Jingmingjiayuan station,353,station,3,"Jingmingjiayuan station

Jingmingjiayuan station (), is a station of Line S3 of the Nanjing Metro. It started operations on 6 December 2017.",jingmingjiayuan station jingmingjiayuan station station s3 nanj metro. start oper 6 decemb 2017.
353,Index of Sri Lanka related articles C,354,sri lanka articl,2,"Index of Sri Lanka-related articles (C)

This page lists Sri Lanka-related articles with titles beginning with an alphabet letter C.",sri lanka articl list sri lanka articl titl alphabet letter c.
354,Tiexinqiao station,355,station,3,"Tiexinqiao station

Tiexinqiao station (), is a station of Line S3 of the Nanjing Metro. It started operations on 6 December 2017.",tiexinqiao station tiexinqiao station station s3 nanj metro. start oper 6 decemb 2017.
355,Index of Sri Lanka related articles D,356,sri lanka articl,2,"Index of Sri Lanka-related articles (D)

This page lists Sri Lanka-related articles with titles beginning with an alphabet letter D.",sri lanka articl list sri lanka articl titl alphabet letter d.
356,Randy Dickens,357,dicken coach quinci,4,"Randy Dickens

Clark Randy Dickens is an American football coach. He is currently an assistant coach at Quincy Senior High School in Quincy, Illinois. In 1986, he became the new head coach at Quincy University, which had previously disbanded football in 1953. Dickens remained at Quincy until 1990, compiling a career record of 25–22–1.

Dickens is the son of former Wofford, Wyoming and Indiana head coach Phil Dickens.",randi dicken clark randi dicken american footbal coach. assist coach quinci senior high school quinci illinois. 1986 head coach quinci univers disband footbal 1953. dicken remain quinci 1990 compil career record 25 22 1. dicken son wofford wyom indiana head coach phil dickens.
357,Chunjianglu station,358,station,3,"Chunjianglu station

Chunjianglu station (), is a station of Line S3 of the Nanjing Metro. It started operations on 6 December 2017.",chunjianglu station chunjianglu station station s3 nanj metro. start oper 6 decemb 2017.
358,Index of Sri Lanka related articles E,359,sri lanka articl,2,"Index of Sri Lanka-related articles (E)

This page lists Sri Lanka-related articles with titles beginning with an alphabet letter E.",sri lanka articl list sri lanka articl titl alphabet letter e.
359,Jiaxi station,360,station,3,"Jiaxi station

Jiaxi station (), is a station of Line S3 of the Nanjing Metro. It started operations on 6 December 2017.",jiaxi station jiaxi station station s3 nanj metro. start oper 6 decemb 2017.
360,Kunzea occidentalis,361,long,7,"Kunzea occidentalis

Kunzea occidentalis is a flowering plant in the myrtle family, Myrtaceae and is endemic to a western New South Wales. It is a shrub with narrow leaves and small groups of white flowers on leafy side-branches. It is distinguished from the similar ""Kunzea ambigua"" by the flanges on the sides of its young branches.

""Kunzea occidentalis"" is a shrub which usually grows to a height of with its young branches having its leaf bases as raised, spongy, cream-coloured tissue. The leaves are arranged alternately, linear to narrow lance-shaped, long and about wide with a petiole usually less than long. The flowers are arranged singly or in groups of up to six near the ends of the branches. There are egg-shaped to elliptic bracts about long and wide and smaller paired bracteoles at the base of the flowers. The floral cup is glabrous and long with the sepal lobes long and glabrous. The petals are white, broadly egg-shaped to almost round and about long. There are about 50-60 stamens which are long.

""Kunzea occidentalis"" was first formally described in 2016 by Hellmut R. Toelken and the description was published in ""Journal of the Adelaide Botanic Garden"". The specific epithet (""occidentalis"") is a Latin word meaning ""western"" referring to the distribution of this species on the western side of the Great Dividing Range.

This kunzea grows in heath and forest, mainly in rocky places and in creek beds. It is found on the western slopes of the Great Dividing Range and is common in the Warrumbungle and Mount Kaputar national parks.",kunzea occidentali kunzea occidentali flower plant myrtl famili myrtacea endem western south wales. shrub narrow leaf small group white flower leafi branches. distinguish kunzea ambigua flang side young branches. kunzea occidentali shrub grow height young branch leaf base rais spongi cream colour tissue. leaf arrang altern linear narrow lanc shape long wide petiol long. flower arrang singli group end branches. egg shape ellipt bract long wide small pair bracteol base flowers. floral cup glabrou long sepal lobe long glabrous. petal white broadli egg shape long. 50 60 stamen long. kunzea occidentali formal 2016 hellmut r. toelken descript publish journal adelaid botan garden . specif epithet occidentali latin word mean western refer distribut speci western great divid range. kunzea grow heath forest rocki place creek beds. western slope great divid rang common warrumbungl mount kaputar nation parks.
361,Joseph Vithayathil,362,mariam thresia,5,"Joseph Vithayathil

Joseph Vithayathil was a priest from India who has been declared as Venerable by the Catholic Church.
He was born in Puthenpally, Trichur District of Kerala State of India to Catholic parents of the Vithayathil family on 23 July 1865. He had two brothers and two sisters.

At the suggestion of his parish priest Fr. Zecharias, he started priestly studies and joined the seminary on 30 May 1881. He was ordained as Priest on 11 March 1894 by Bishop Mar Adolph Medlycott of Thrissur Diocese at the St. Antony's Church, Ollur with 11 others.

After being diocesan priest for a few years, in 1902<ref name=""Https://mariamthresia.org_2018-01-03c""></ref> he was sent to perform exorcisms on a young mystic girl called Mariam Thresia. Here he became her Spiritual director until her death in 1926. He asked her to write her life story from early childhood, on the instructions of his Bishop. This resulted in the Autobiographical Notes of Blessed Mariam Thresia dealing with her life experiences and events up to 1905.

He helped her establish the on 14 May 1914 blessed by Mar John Menachery. He was appointed as the Chaplain of this convent in 1922. After the death of the Mariam Thresia, he guided the congregation until the formation of its General Council in 1942. Under his guidance a school for teaching stitching, tailoring, weaving, knitting etc. was started in 1929 at Kuzhikkattussery. 
He died on 08 June 1964 (same date on which Mariam Thresia died) and was buried at Kuzhikkattussery near the tomb of Mariam Thresia.
He was declared as Servant of God on 18 May 2004 by Pope John Paul II. Mar Paul Alapatt, the current bishop of Ramanathapuram Diocese, was the Promotor of Justice for the Cause of the Servant of God Fr. Joseph Vithayathil. He was elevated to Venerable on 14 December 2015 by Pope Francis along with 16 others.",joseph vithayathil joseph vithayathil priest india declar vener cathol church. born puthenp trichur district kerala india cathol parent vithayathil famili 23 juli 1865. brother sisters. suggest parish priest fr. zecharia start priestli studi join seminari 30 1881. ordain priest 11 march 1894 bishop mar adolph medlycott thrissur dioces st. antoni church ollur 11 others. diocesan priest year 1902 http mariamthresia.org_2018 01 03c perform exorc young mystic girl call mariam thresia. spiritu director death 1926. ask write life stori earli childhood instruct bishop. autobiograph note bless mariam thresia deal life experi event 1905. help establish 14 1914 bless mar john menachery. appoint chaplain convent 1922. death mariam thresia guid congreg format gener council 1942. guidanc school teach stitch tailor weav knit etc. start 1929 kuzhikkattussery. die 08 june 1964 mariam thresia die buri kuzhikkattusseri tomb mariam thresia. declar servant god 18 2004 pope john paul ii. mar paul alapatt current bishop ramanathapuram dioces promotor justic servant god fr. joseph vithayathil. elev vener 14 decemb 2015 pope franci 16 others.
362,Index of Sri Lanka related articles F,363,sri lanka articl,2,"Index of Sri Lanka-related articles (F)

This page lists Sri Lanka-related articles with titles beginning with an alphabet letter F.",sri lanka articl list sri lanka articl titl alphabet letter f.
363,Bell Boy 13,364,film,4,"Bell Boy 13

Bell Boy 13 is a 1923 American silent comedy film directed by William A. Seiter, and starring Douglas MacLean, John Steppling, Margaret Loomis, William Courtright, Emily Gerdes, and Eugene Burr. The film was released by First National Pictures on January 19, 1923.


Prints of the film survives in the Library of Congress and UCLA Film and Television Archive.",bell boy 13 bell boy 13 1923 american silent comedi film direct william a. seiter star dougla maclean john steppl margaret loomi william courtright emili gerd eugen burr. film releas nation pictur januari 19 1923. print film surviv librari congress ucla film televis archive.
364,Yongchulu station,365,station,3,"Yongchulu station

Yongchulu station (), is a station of Line S3 of the Nanjing Metro. It started operations on 6 December 2017.",yongchulu station yongchulu station station s3 nanj metro. start oper 6 decemb 2017.
365,Pingliangdajie station,366,station,3,"Pingliangdajie station

Pingliangdajie station (), is a station of Line S3 of the Nanjing Metro. It started operations on 6 December 2017.",pingliangdaji station pingliangdaji station station s3 nanj metro. start oper 6 decemb 2017.
366,Index of Sri Lanka related articles G,367,sri lanka articl,2,"Index of Sri Lanka-related articles (G)

This page lists Sri Lanka-related articles with titles beginning with an alphabet letter G.",sri lanka articl list sri lanka articl titl alphabet letter g.
367,Scarlet fever disambiguation,368,scarlet fever,3,"Scarlet fever (disambiguation)

Scarlet fever is a relatively common disease.

Scarlet Fever may also refer to:",scarlet fever disambigu scarlet fever common disease. scarlet fever refer
368,Index of Sri Lanka related articles H,369,sri lanka articl,2,"Index of Sri Lanka-related articles (H)

This page lists Sri Lanka-related articles with titles beginning with an alphabet letter H.",sri lanka articl list sri lanka articl titl alphabet letter h.
369,Vashon Island School District,370,vashon island school district,3,"Vashon Island School District

Vashon Island School District is a school district headquartered in Vashon Island, Washington.",vashon island school district vashon island school district school district headquart vashon island washington.
370,Index of Sri Lanka related articles I,371,sri lanka articl,2,"Index of Sri Lanka-related articles (I)

This page lists Sri Lanka-related articles with titles beginning with an alphabet letter I.",sri lanka articl list sri lanka articl titl alphabet letter i.
371,Pomptina gens,372,pomptina gen,3,"Pomptina (gens)

The gens Pomptina was a minor plebeian family at ancient Rome. The gens is best known from Gaius Pomptinus, praetor in 63 BC, who helped suppress the conspiracy of Catiline, and later defeated the Allobroges. Few of the Pomptini appear in history, but others are known from inscriptions.

The nomen ""Pomptinus"" seems to be derived from the region of the Pomptine Marshes, in southeastern Latium. This area was brought under Roman control following the defeat of the Volscians in 358 BC, and the ""tribus Pomptina"" organized. The Pomptini might be of either Latin or Volscian origin. In different sources, the nomen can be found as ""Pomptinius"", ""Pontinius"", ""Pomtinus"", and ""Pontinius"".",pomptina gen gen pomptina minor plebeian famili ancient rome. gen gaiu pomptinu praetor 63 bc help suppress conspiraci catilin defeat allobroges. pomptini histori inscriptions. nomen pomptinu deriv region pomptin marsh southeastern latium. area brought roman control defeat volscian 358 bc tribu pomptina organized. pomptini latin volscian origin. sourc nomen pomptiniu pontiniu pomtinu pontiniu .
372,Index of Sri Lanka related articles J,373,sri lanka articl,2,"Index of Sri Lanka-related articles (J)

This page lists Sri Lanka-related articles with titles beginning with an alphabet letter J.",sri lanka articl list sri lanka articl titl alphabet letter j.
373,Index of Sri Lanka related articles K,374,sri lanka articl,2,"Index of Sri Lanka-related articles (K)

This page lists Sri Lanka-related articles with titles beginning with an alphabet letter K.",sri lanka articl list sri lanka articl titl alphabet letter k.
374,Zapote River Philippines,375,zapot river,6,"Zapote River (Philippines)

Zapote River is a river in the Philippines located between the border of the Province of Cavite, and Metro Manila. Zapote River has a length of 5.81 kilometres.

The Battle of Zapote River was fought on June 13, 1899 between 1,200 Americans and between 4,000~5,000 Filipinos. It was the second largest battle of the Philippine–American War after the Battle of Manila five months before in February 1899. Zapote River separates the town of Las Piñas in what was then Manila province from Bacoor in the province of Cavite. The ruins of Zapote Bridge still stands next to its replacement bridge on Aguinaldo Highway.",zapot river philippin zapot river river philippin locat border provinc cavit metro manila. zapot river length 5.81 kilometres. battl zapot river fought june 13 1899 1 200 american 4 000 5 000 filipinos. larg battl philippin american war battl manila month februari 1899. zapot river separ town la piña manila provinc bacoor provinc cavite. ruin zapot bridg stand replac bridg aguinaldo highway.
375,Index of Sri Lanka related articles L,376,sri lanka articl,2,"Index of Sri Lanka-related articles (L)

This page lists Sri Lanka-related articles with titles beginning with an alphabet letter L.",sri lanka articl list sri lanka articl titl alphabet letter l.
376,Piano Trio No 2 Dvořák,377,trio,4,"Piano Trio No. 2 (Dvořák)

Antonín Dvořák's Piano Trio No. 2 in G minor, Op. 26 (B. 57), is a chamber composition, written in 1876. The trio was written shortly after the death of his eldest daughter Josefa, and although Dvorak never wrote that the piece was intended as a memorial it is generally regarded as such. The Presto - Trio movement foreshadows the more well-known ""Slavonic Dances"".

The composition consists of four movements in the classical tradition:",piano trio no. 2 dvořák antonín dvořák piano trio no. 2 minor op. 26 b. 57 chamber composit write 1876. trio write shortli death eldest daughter josefa dvorak write piec intend memori gener regard such. presto trio movement foreshadow slavon danc . composit consist movement classic tradit
377,Muhammad Idrees,378,member,3,"Muhammad Idrees

Muhammad Idrees is a Pakistani politician hailing from Nowshera District, who is currently a member of the Khyber Pakhtunkhwa Assembly, belonging to the Pakistan Tehreek-e-Insaf. He is also serving as chairman and member of the different committees.

Idrees was elected as the member of the Khyber Pakhtunkhwa Assembly on ticket of Pakistan Tehreek-e-Insaf from PK-15 (Nowshera-IV) in Pakistani general election, 2013.",muhammad idre muhammad idre pakistani politician hail nowshera district member khyber pakhtunkhwa assembl belong pakistan tehreek insaf. serv chairman member committees. idre elect member khyber pakhtunkhwa assembl ticket pakistan tehreek insaf pk 15 nowshera iv pakistani gener elect 2013.
378,Index of Sri Lanka related articles M,379,sri lanka articl,2,"Index of Sri Lanka-related articles (M)

This page lists Sri Lanka-related articles with titles beginning with an alphabet letter M.",sri lanka articl list sri lanka articl titl alphabet letter m.
379,Protonympha,380,fossil,5,"Protonympha

Protonympha is a form genus for problematic fossils of Devonian age in New York. It has been of special interest because of its morphological similarity with the iconic Ediacaran fossil ""Spriggina"", and may have been a late surviving vendobiont. 

""Protonympha"" is a flat, quilted fossil, which in the past has been compared with the arm of a starfish or an annelid worm, but lacks a segmented carapace or stereom. Its preservation in sandstone is like Ediacaran type preservation. It is not found with marine fossils, but only with plant fossils and freshwater fish, and its rhizoid-like extensions are evidence it lived on land.",protonympha protonympha form genu problemat fossil devonian age york. special morpholog similar icon ediacaran fossil spriggina late surviv vendobiont. protonympha flat quilt fossil compar arm starfish annelid worm lack segment carapac stereom. preserv sandston ediacaran type preservation. marin fossil plant fossil freshwat fish rhizoid extens evid live land.
380,Index of Sri Lanka related articles N,381,sri lanka articl,2,"Index of Sri Lanka-related articles (N)

This page lists Sri Lanka-related articles with titles beginning with an alphabet letter N.",sri lanka articl list sri lanka articl titl alphabet letter n.
381,Damián Patriarca,382,patriarca tenni,4,"Damián Patriarca

Damián Patriarca (born 28 June 1983) is a former professional tennis player from Argentina.

Born in Paraná to Sergio and Silvia Patriarca, he is one of three brothers and learned his tennis at the local Club de Tenis Urquiza.

Patriarca, who played right-handed, turned professional in 2000 and won regular titles on the Futures circuit during his career. In 2005 he won two Challenger tournaments in doubles and was singles runner-up at the Geneva Open Challenger, along the way beating Andreas Vinciguerra and Óscar Hernández. He took part in the qualifying draw of the men's singles at the 2006 Wimbledon Championships and a month later qualified for the Austrian Open Kitzbühel, his only main draw appearance on the ATP Tour. In the first round he played an Austrian, Andreas Haider-Maurer, who beat him in three sets.

An ankle injury forced him to retire from professional tennis aged 24 and he instead turned to coaching. He was the coach of Juan Mónaco in the 2013 season and has since moved to the Mexican city of Acapulco to run a tennis school.",damián patriarca damián patriarca born 28 june 1983 profession tenni player argentina. born paraná sergio silvia patriarca brother learn tenni local club teni urquiza. patriarca play hand turn profession 2000 regular titl futur circuit career. 2005 challeng tournament doubl singl runner geneva open challeng beat andrea vinciguerra óscar hernández. qualifi draw men singl 2006 wimbledon championship month qualifi austrian open kitzbühel main draw appear atp tour. play austrian andrea haider maurer beat sets. ankl injuri forc retir profession tenni age 24 turn coaching. coach juan mónaco 2013 season move mexican citi acapulco tenni school.
382,Index of Sri Lanka related articles O,383,sri lanka articl,2,"Index of Sri Lanka-related articles (O)

This page lists Sri Lanka-related articles with titles beginning with an alphabet letter O.",sri lanka articl list sri lanka articl titl alphabet letter o.
383,Rooks County Courthouse,384,rook counti,2,"Rooks County Courthouse

The Rooks County Courthouse, located at 115 N. Walnut St. in Stockton, Kansas, was listed on the National Register of Historic Places in 2002.

It was designed by architect Frank C. Squires and was built by Cuthbert and Sons. It is a four-story Classical Revival-style building which is in plan and tall.",rook counti courthous rook counti courthous locat 115 n. walnut st. stockton kansa list nation regist histor place 2002. design architect frank c. squir built cuthbert sons. stori classic reviv style build plan tall.
384,Index of Sri Lanka related articles P,385,sri lanka articl,2,"Index of Sri Lanka-related articles (P)

This page lists Sri Lanka-related articles with titles beginning with an alphabet letter P.",sri lanka articl list sri lanka articl titl alphabet letter p.
385,Pawned film,386,film,4,"Pawned (film)

Pawned is a 1922 American silent melodrama film directed by Irvin Willat, and starring Tom Moore, Edith Roberts, Charles K. Gerrard, Josef Swickard, Mabel Van Buren, and James O. Barrows. It is based on the 1921 novel of the same name by Frank L. Packard. The film was released by Selznick Distributing Corporation on November 13, 1922.


The film is now considered lost.",pawn film pawn 1922 american silent melodrama film direct irvin willat star tom moor edith robert charl k. gerrard josef swickard mabel van buren jame o. barrows. base 1921 frank l. packard. film releas selznick distribut corpor novemb 13 1922. film consid lost.
386,Glenlyon Queensland,387,glenlyon,3,"Glenlyon, Queensland

Glenlyon is a locality in the Southern Downs Region, Queensland, Australia.

The locality's name is derived from Glenlyon pastoral run taken up in 1844 by Alexander McLeod. The run can be seen on an 1883 Darling Downs Run Map on Pikes Creek, south of Pikes Creek run.",glenlyon queensland glenlyon local southern down region queensland australia. local deriv glenlyon pastor 1844 alexand mcleod. 1883 darl down map pike creek south pike creek run.
387,List of wars involving Lesotho,388,list war involv lesotho,1,List of wars involving Lesotho,list war involv lesotho
