,title,id,max_occur_words,max_occur_number,content_original,content
222,1912–13 Dundee Hibernian F C season,223,1912 dunde hibernian,4,"1912–13 Dundee Hibernian F.C. season

The 1912-13 season was the 4th year of football played by Dundee Hibernian, and covers the period from 1 July 1912 to 30 June 1913.

Dundee Hibernian played a total of 23 matches during the 1912–13 season.

All results are written with Dundee Hibernian's score first.
Own goals in italics",1912 13 dunde hibernian f.c. season 1912 13 season 4th year footbal play dunde hibernian cover period 1 juli 1912 30 june 1913. dunde hibernian play total 23 match 1912 13 season. write dunde hibernian score first. goal ital
223,2007 Saint Francis Cougars football team,224,saint franci,7,"2007 Saint Francis Cougars football team

The 2007 Saint Francis Cougars football team represented the University of Saint Francis, located in Fort Wayne, Indiana, in the 2007 NAIA football season. They were led by head coach Kevin Donley, who served his 10th year as the first and only head coach in the history of Saint Francis football. The Cougars played their home games at Bishop John D'Arcy Stadium and were members of the Mid-States Football Association (MSFA) Mideast League (MEL). The Cougars finished in 2nd place in the MSFA MEL division, but they received an at-large bid to the 2007 postseason NAIA playoffs.

The Saint Francis Cougars have a history of playing championship-quality teams. One of their two losses of the 2007 season was to eventual national champion Carroll (MT) in the semifinal round of the playoffs. This marked the xxth time in the history of Saint Francis football that the team's schedule included a loss to the best team in the nation.

On September 29, 2007, the Saint Francis loss to Ohio Dominican snapped a 54-game regular season winning streak dating back to 2001.",2007 saint franci cougar footbal team 2007 saint franci cougar footbal team repres univers saint franci locat fort wayn indiana 2007 naia footbal season. lead head coach kevin donley serv 10th year head coach histori saint franci football. cougar play game bishop john arci stadium member mid footbal associ msfa mideast leagu mel . cougar finish 2nd place msfa mel divis receiv larg bid 2007 postseason naia playoffs. saint franci cougar histori play championship qualiti teams. loss 2007 season eventu nation champion carrol mt semifin playoffs. mark xxth time histori saint franci footbal team schedul includ loss team nation. septemb 29 2007 saint franci loss ohio dominican snap 54 game regular season win streak date 2001.
224,Jacob Richards soldier,225,armi,6,"Jacob Richards (soldier)

Jacob Richards was an Irish soldier of the seventeenth century known for his service with the English Army. In the War of the Two Kings in Ireland he fought for William III agains the Jacobite Irish Army of James II. During the campaign he was Chief Engineer with charge of the Royal Artillery.

He was an Irish Protestant raised partly on his father's estates in County Wexford. His father Solomon Richards had served in the New Model Army under Oliver Cromwell.

In 1689 he oversaw the artillery bombardment during the Siege of Carrickfergus, where he was wounded three times. He was apparently present at the Battle of the Boyne in 1690 and at the decisive Siege of Limerick the next year.

In 1692 following the Treaty of Limerick which ended the Irish War, much of his force was redeployed to Flanders where William was leading an Allied Army against the French. His sons Jacob and Michael both oversaw the Artillery during the Battles of Steenkirk and Landen and went some way to establishing the traditions of the Royal Artillery.

He had three sons, all of whom pursued military careers. The eldest, also called Jacob, served as part of the Tangier Garrison and later with William of Orange in Flanders. He died in 1701. The second son John Richards converted to Catholicism. This led him to serve abroad in the Austrian Army. In 1703 during the War of the Spanish Succession he was commissioned into the Portuguese Army allied to Britain. He was killed at the Siege of Alicante in 1709. The youngest Michael Richards was appointed Chief Engineer of Great Britain in 1711.

His daughter Elizabeth married the English politician James Craggs.",jacob richard soldier jacob richard irish soldier seventeenth centuri servic english army. war king ireland fought william iii again jacobit irish armi jame ii. campaign chief engin charg royal artillery. irish protest rais partli father estat counti wexford. father solomon richard serv model armi oliv cromwell. 1689 oversaw artilleri bombard sieg carrickfergu wound times. battl boyn 1690 decis sieg limerick year. 1692 treati limerick end irish war forc redeploy flander william lead alli armi french. son jacob michael oversaw artilleri battl steenkirk landen establish tradit royal artillery. son pursu militari careers. eldest call jacob serv tangier garrison william orang flanders. die 1701. son john richard convert catholicism. lead serv austrian army. 1703 war spanish success commiss portugues armi alli britain. kill sieg alicant 1709. young michael richard appoint chief engin great britain 1711. daughter elizabeth marri english politician jame craggs.
225,List of UK Dance Singles Chart number ones of 2018,226,chart,7,"List of UK Dance Singles Chart number ones of 2018

The UK Dance Singles Chart is a weekly music chart compiled in the United Kingdom by the Official Charts Company (OCC) from sales of songs in the dance music genre (house, drum and bass, dubstep, etc.) in record stores and digital downloads. The chart week runs from Friday to Thursday with the chart-date given as the following Thursday.

This is a list of the songs which were number one on the UK Dance Singles Chart during 2018.",list uk danc singl chart number 2018 uk danc singl chart weekli music chart compil unit kingdom offici chart compani occ sale song danc music genr hous drum bass dubstep etc. record store digit downloads. chart week run friday thursday chart thursday. list song number uk danc singl chart 2018.
226,Jeff Meendering,227,jeff crew chief,3,"Jeff Meendering

Jeff Meendering is an American NASCAR crew chief. He served as crew chief for Jeff Gordon (No. 24 Hendrick Motorsports) and Bobby Labonte (No. 43 Petty Enterprises) in 2007 and 2008, respectively. He currently works at Stewart-Haas Racing, serving as the crew chief for the No. 00 Ford Mustang driven by Cole Custer in the NASCAR Xfinity Series. They will both return in the 2018 season.",jeff meender jeff meender american nascar crew chief. serv crew chief jeff gordon no. 24 hendrick motorsport bobbi labont no. 43 petti enterpris 2007 2008 respectively. work stewart haa race serv crew chief no. 00 ford mustang driven cole custer nascar xfiniti series. return 2018 season.
227,Duncan Thomson,228,duncan thomson,2,"Duncan Thomson

Duncan Thomson (born October 1934) is a former director of the Scottish National Portrait Gallery and an authority on the art of Allan Ramsay.",duncan thomson duncan thomson born octob 1934 director scottish nation portrait galleri author art allan ramsay.
228,Edward H Hammond,229,hammond univers,20,"Edward H. Hammond

Edward H. Hammond (born May 4, 1944) is an American educator and former president of Fort Hays State University. Prior to his position at Fort Hays State, Hammond served in student affairs at various institutions including Seton Hall University and the University of Louisville. Hammond completed just two months shy of 28 years, making him the longest serving president at Fort Hays State and leader in the Kansas Board of Regents schools.

A native of McAllen, Texas but raised in Roeland Park, Kansas, Hammond graduated from Emporia State University in 1966 and completed his master's degree from Emporia State, as well, in 1967. In 1971, Hammond completed his doctor of philosophy from the University of Missouri.

After completing his doctorate from the University of Missouri, Hammond served as Assistant to the Southern Illinois University Carbondale Chancellor from 1970 to 1972 when he was promoted to Assistant Dean of Students. He served that position for a year. Following his stint at Southern Illinois, Hammond became Seton Hall University's student affairs vice president, a position he held from 1973 to 1976. On July 1, 1976, Hammond was named the University of Louisville's first Student Affairs vice president.

As the first student affairs vice president, Hammond was tasked with creating the student affairs division for the university. During his ten years there, Hammond created departments as well as hired staff to oversee already created departments such as Greek Life. Hammond left for Fort Hays State University in March 1987.

On March 1, 1987, Hammond began his nearly 28-year career as president of Fort Hays State University. During his time at Fort Hays State, Hammond created relationships with the Western Kansas community colleges, expanded the university with additions of new buildings, wind turbines and created the university's first online college system for distance education in 1997. Hammond also built a relationship with SIAS International University in China, establishing a bachelor's program there and making Fort Hays State the first university in the United States to be approved by the Chinese Ministry of Education. Hammond also increased the university's enrollment by 9,000 students over the course of 27 years.

On the athletics side, Hammond helped the university athletic programs transition from the National Association of Intercollegiate Athletics to the National Collegiate Athletic Association Division II, completing the move in 1991. Fifteen years later, Hammond also helped move the university from the Rocky Mountain Athletic Conference to the university's current conference, the Mid-America Intercollegiate Athletics Association in 2006. Hammond was also instrumental in creating the softball program in 1999, and both men's and women's soccer in 2011.

Hammond retired from Fort Hays State on June 30, 2014.",edward h. hammond edward h. hammond born 4 1944 american educ presid fort hay university. prior posit fort hay hammond serv student affair institut includ seton hall univers univers louisville. hammond complet month shi 28 year make long serv presid fort hay leader kansa board regent schools. nativ mcallen texa rais roeland park kansa hammond graduat emporium univers 1966 complet master degre emporium 1967. 1971 hammond complet doctor philosophi univers missouri. complet doctor univers missouri hammond serv assist southern illinoi univers carbondal chancellor 1970 1972 promot assist dean students. serv posit year. stint southern illinoi hammond seton hall univers student affair vice presid posit held 1973 1976. juli 1 1976 hammond name univers louisvil student affair vice president. student affair vice presid hammond task creat student affair divis university. year hammond creat depart hire staff overse creat depart greek life. hammond left fort hay univers march 1987. march 1 1987 hammond begin 28 year career presid fort hay university. time fort hay hammond creat relationship western kansa commun colleg expand univers addit build wind turbin creat univers onlin colleg distanc educ 1997. hammond built relationship sia intern univers china establish bachelor program make fort hay univers unit approv chines ministri education. hammond increas univers enrol 9 000 student 27 years. athlet hammond help univers athlet program transit nation associ intercollegi athlet nation collegi athlet associ divis ii complet 1991. year hammond help univers rocki mountain athlet confer univers current confer mid america intercollegi athlet associ 2006. hammond instrument creat softbal program 1999 men woman soccer 2011. hammond retir fort hay june 30 2014.
229,HMS Earnest,230,hm earnest,2,"HMS Earnest

Three ships of the British Royal Navy have been named HMS ""Earnest"":",hm earnest ship british royal navi name hm earnest
230,1950 Penya Rhin Grand Prix,231,1950,3,"1950 Penya Rhin Grand Prix

The 1950 Penya Rhin Grand Prix was a non-championship Formula One motor race held at Pedralbes Circuit on 20 October 1950.",1950 penya rhin grand prix 1950 penya rhin grand prix championship formula motor race held pedralb circuit 20 octob 1950.
231,The Island album,232,album,5,"The Island (album)

The Island is an album by American pop singer Johnny Mathis that was completed for Columbia Records in 1989 but not released in its entirety by parent corporation Sony Music Entertainment until December 8, 2017, when it was included in the Mathis box set """". The liner notes for the box set indicate that all of the songs for this album were recorded on August 18, 1989.

In his review of the album, Joe Marchese of The Second Disc opined, ""Whether expressing yearning on 'Wanting More' or wistful optimism on 'We Can Try Love Again,' the beautiful music of Brazil inspired some of Johnny’s sweetest vocals of the decade.""


Credits are taken from the liner notes for ""The Voice of Romance: The Columbia Original Album Collection""",island album island album american pop singer johnni mathi complet columbia record 1989 releas entireti parent corpor soni music entertain decemb 8 2017 includ mathi box set . liner note box set song album record august 18 1989. review album joe marches disc opin express yearn want wist optim love beauti music brazil inspir johnny’ sweetest vocal decade. credit liner note voic romanc columbia origin album collect
232,Saint Menas church attack,233,attack,3,"Saint Menas church attack

On December 29, 2017, in Helwan, Cairo, Egypt, a gunman opened fire at the Coptic Orthodox Church of Saint Menas and a nearby shop owned by a Coptic man, killing ten citizens and a police officer and injuring around ten people. He was wounded by police and arrested. Investigators said he had carried out several attacks in the last year.
Later, Amaq News Agency described that terrorist attack was carried out by a person belonging to the Islamic state.",saint mena church attack decemb 29 2017 helwan cairo egypt gunman open coptic orthodox church saint mena nearbi shop own coptic man kill citizen polic offic injur people. wound polic arrested. investig carri attack year. amaq news agenc terrorist attack carri person belong islam state.
233,Jacky Klein,234,klein art,3,"Jacky Klein

Jacky Klein (born January 1977) is a British art historian, broadcaster, and author. In 2016 she co-presented ""Britain's Lost Masterpieces"" for BBC4 with Bendor Grosvenor. She co-authored a book with her sister, Suzy Klein, entitled ""What is Contemporary Art? A Children's Guide"", commissioned by the Museum of Modern Art, New York, and published in 2012 by Thames & Hudson. It has been translated into seven languages. In 2015 she was announced as the new director of Tate Publishing.",jacki klein jacki klein born januari 1977 british art historian broadcast author. 2016 present britain lose masterpiec bbc4 bendor grosvenor. author book sister suzi klein entitl contemporari art? child guid commiss museum modern art york publish 2012 thame hudson. translat languages. 2015 announc director tate publishing.
234,Rubén Hernández Sánchez,235,rubén hernández sánchez born,2,"Rubén Hernández Sánchez

Rubén Hernández Sánchez (born July 10, 1968) is a Mexican football manager and former player. He was born in Mexico City.",rubén hernández sánchez rubén hernández sánchez born juli 10 1968 mexican footbal manag player. born mexico city.
235,Estonia at the Youth Olympics,236,estonia youth game,2,"Estonia at the Youth Olympics

Estonia has participated at the Youth Olympic Games since the inaugural 2010 Games and every edition after that.",estonia youth olymp estonia particip youth olymp game inaugur 2010 game edit that.
236,Pánuco minnow,237,pánuco minnow,2,"Pánuco minnow

The Pánuco minnow (""Tampichthys catostomops"") is a species of cyprinid fish endemic to Mexico.",pánuco minnow pánuco minnow tampichthi catostomop speci cyprinid fish endem mexico.
237,Cosmic Knot,238,knot,10,"Cosmic Knot

Cosmic Knot is an American rock band from Grand Rapids, Michigan U.S.. The group was founded in 2015, by Tom Wall and is noted for its positive and uplifting, experimental progressive indie-rock sound that they have termed """"Gypsycore"""".

The band prefers to play in alternate tunings, such as Verdi tuning (A=432 hz) as opposed to the A440 (pitch standard) in the hopes of promoting a healing and overall calming effect on listeners.

In 2016, Cosmic Knot recorded their debut album called ""Inner Space"" at Third Coast Recording Studio, in Grand Haven, Michigan, which is owned and operated by noted audio engineer Bill Chrysler. The album was mastered by Capitol Records engineer Ian Selfchick, and was released in August of 2017. It quickly rose up the ""Relix Jam Band radio charts"" and has stayed there since it was released. Cosmic Knot has been nominated for two 2017 WYCE-FM’s Jammie Awards for their CD ""Inner Space"".

Cosmic Knot were the headlining band at the 2015, 2016 and 2017 ""Wish You Were Here"" festivals in Holton, Michigan.

In 2017, Cosmic Knot won the ""Best Song"" contest at Grand Haven’s ""Walk the Beat"" festival for their song ""Like a Gypsy"".

Cosmic Knot performed at the 2017 Hash Bash in Ann Arbor, Michigan. Tom Wall performed the Star Spangled Banner on guitar, to start the event, and the whole band performed a full set afterwards, performing for over 10,000 people.

On January 5th, 2018, Cosmic Knot won the ""Kalamazoo Fretboard Festival"" Play-in Contest in the electric category, and will also appear at the 13th Annual Fretboard Festival to be held March 2-3, 2018.

Cosmic Knot consists of Tom Wall on vocals and guitar, Hayaman Mana Tzach on drums, keyboards and backup vocals, Zach Gregory on bass guitar, and Rolly Smith on saxophone.

The members of Cosmic Knot have either jammed, shared the stage, or recorded with musicians such as P-Funk All Stars members Muruga Booker and Tony ""Strat"" Thomas, jazz clarinetist Perry Robinson, Joel Cummins from Umphrey's McGee, Misty Love (backup singer for Kid Rock and Sheryl Crow, as well as Ben Harper), and Rock and Roll Hall of Fame inductee Billy Davis.",cosmic knot cosmic knot american rock band grand rapid michigan u.s.. group found 2015 tom wall posit uplift experiment progress indi rock sound term gypsycor . band prefer play altern tune verdi tune 432 hz oppos a440 pitch standard hope promot heal calm listeners. 2016 cosmic knot record debut album call space coast record studio grand michigan own oper audio engin chrysler. album master capitol record engin ian selfchick releas august 2017. rise relix jam band radio chart stay released. cosmic knot nomin 2017 wyce fm’ jammi award cd space . cosmic knot headlin band 2015 2016 2017 festiv holton michigan. 2017 cosmic knot song contest grand haven’ walk beat festiv song gypsi . cosmic knot perform 2017 hash bash ann arbor michigan. tom wall perform star spangl banner guitar start event band perform set perform 10 000 people. januari 5th 2018 cosmic knot kalamazoo fretboard festiv play contest electr categori 13th annual fretboard festiv held march 2 3 2018. cosmic knot consist tom wall vocal guitar hayaman mana tzach drum keyboard backup vocal zach gregori bass guitar rolli smith saxophone. member cosmic knot jam share stage record musician funk star member muruga booker toni strat thoma jazz clarinetist perri robinson joel cummin umphrey mcgee misti love backup singer kid rock sheryl crow ben harper rock roll hall fame inducte billi davis.
238,The Voice of Romance The Columbia Original Album Collection,239,music,5,"The Voice of Romance: The Columbia Original Album Collection

The Voice of Romance: The Columbia Original Album Collection is a 68-disc box set by American pop singer Johnny Mathis that was released on December 8, 2017, by Legacy Recordings, a division of Sony Music Entertainment. The packaging noted that it includes 67 albums that have been remastered, several of which were being made available on CD for the first time. Two of those, ""I Love My Lady"" and ""The Island"", were debuting in their entirety for the first time anywhere, and 38 of the bonus tracks included had also previously gone unreleased. 

In his review of the box set for The Second Disc, Joe Marchese asserted, ""What it reveals is that the history of Johnny Mathis is, put simply, the history of American music in the second half of the twentieth century."" In summation he wrote, ""Since Johnny Mathis's recording debut, virtually everything has changed about the sound of music, not to mention the music industry. But Mathis has held steadfast to his core values as an artist, and as a 'singer's singer,' as he’s happily traversed from genre to genre. That consistence of quality and variation of style makes the immersive journey contained in ""The Voice of Romance: The Columbia Original Album Collection"" one well worth taking for any fan or collector of American popular song. Basking in the glow of this nostalgic trip, you just might get misty yourself.""

Recording dates and release information taken from the liner notes.

Recording dates and release information taken from the liner notes.


Credits taken from the liner notes.


Credits taken from the liner notes.


Images courtesy of Rojon Productions & Sony Music Photo Archives:

Chart positions courtesy of Joel Whitburn & Billboard Publications",voic romanc columbia origin album collect voic romanc columbia origin album collect 68 disc box set american pop singer johnni mathi releas decemb 8 2017 legaci record divis soni music entertainment. packag includ 67 album remast cd time. love ladi island debut entireti time 38 bonu track includ unreleased. review box set disc joe marches assert reveal histori johnni mathi simpli histori american music twentieth century. summat write johnni mathi record debut virtual chang sound music mention music industry. mathi held steadfast core valu artist singer singer he’ happili travers genr genre. consist qualiti variat style immers journey contain voic romanc columbia origin album collect worth fan collector american popular song. bask glow nostalg trip misti yourself. record date releas liner notes. record date releas liner notes. credit liner notes. credit liner notes. imag courtesi rojon product soni music photo archiv chart posit courtesi joel whitburn billboard public
239,Promisedland Queensland,240,promisedland,3,"Promisedland, Queensland

Promisedland is a locality in the Bundaberg Region, Queensland, Australia.

The Burnett River forms the north-western boundary of the locality. The Ned Churchward Weir (originally called the Walla Weir) was built in 1998 across the river between Promisedland and Bungadoo to provide water for irrigation.",promisedland queensland promisedland local bundaberg region queensland australia. burnett river form north western boundari locality. ned churchward weir origin call walla weir built 1998 river promisedland bungadoo provid water irrigation.
240,Kavita kabaddi born 1987,241,kavita kabaddi born 1987,2,"Kavita (kabaddi, born 1987)

Kavita born 12 December 1987 is representative for India in the sport of Kabaddi. She was a member of the team that won a gold medal in the 2010 Asian games in Guangzhou.",kavita kabaddi born 1987 kavita born 12 decemb 1987 repres india sport kabaddi. member team gold medal 2010 asian game guangzhou.
241,2017–18 Harvard Crimson women s basketball team,242,women,5,"2017–18 Harvard Crimson women's basketball team

The 2017–18 Harvard Crimson women's basketball team represents Harvard University during the 2017–18 NCAA Division I women's basketball season. The Crimson, led by thirty-sixth year head coach Kathy Delaney-Smith, play their home games at the Lavietes Pavilion and are members of the Ivy League.

They finished the season 21–6, 8–6 in Ivy League play to finish in third place. They lost in the semifinals of the Ivy Women's Tournament to Princeton. They were invited to the WNIT where defeated New Hampshire in the first round before losing to St. John's in the second round.

!colspan=8 style=| Regular season
!colspan=8 style=| Ivy League Tournament

2017–18 NCAA Division I women's basketball rankings",2017 18 harvard crimson woman basketbal team 2017 18 harvard crimson woman basketbal team repres harvard univers 2017 18 ncaa divis woman basketbal season. crimson lead sixth year head coach kathi delaney smith play game laviet pavilion member ivi league. finish season 21 6 8 6 ivi leagu play finish place. lose semifin ivi woman tournament princeton. invit wnit defeat hampshir lose st. john round. !colspan 8 style regular season !colspan 8 style ivi leagu tournament 2017 18 ncaa divis woman basketbal rank
